card_title|introduction|effect|responsive_effect|image
反击号角|预言家在绝妙的时刻吹响了胜利的号角。|我方场上所有怪兽卡本回合受到的攻击力，防御力加成翻倍。|当对方怪兽发起攻击时，我方场上所有怪兽卡本回合防御力+2。|pictures/counterattack_horn.png
早产预兆|预言家预言了你的提早降临。|获得额外一次翻面召唤一只怪兽蛋的机会。||pictures/premature_birth_sign.png
饥寒交迫|不合时宜的寒潮和饥饿同时到来。||在我方回合，对方场上最后一只怪物被破坏时，再破坏对方2张手牌或场上预言卡。|pictures/cold_starve.png
圣光毁灭|圣光降下天罚，预示着大地之母的唾弃||当场上怪物被战斗破坏时，给予对方该怪物防御力的伤害（最高10）。|pictures/light_boom.png
致命礼物|谁会拒绝可爱的小猫咪呢？|指定我方一只2级及其以下的怪物卡，使其直接攻击对方玩家，但造成的伤害减半。||pictures/dangerous_gift.png
愚者之斧|【装备】在预言家的指引下，人们发现了这个神奇的魔斧。|装备怪物属性无效，不可使用技能。攻击力和防御力+3。||pictures/fool_arc.png
阴暗世仇|预言家说，看吧，这就是你们的世仇。||当我方怪物被战斗破坏时，此卡发动，并将永久存在在场上。我方所有与被破坏那只怪物的种族相同的怪物，在与发动攻击的那个种族的怪物战斗时，攻击+2。|pictures/generation_hate.png
河神献祭|预言家说，有的人需要为繁荣牺牲。|丢弃我方场上一只怪物，抽3张牌。||pictures/sacrifice.png
无畏围攻|预言家说，一起上还怕他什么？|我方场上任意只可以发动攻击的怪兽，以其中一只为主，发动一次联合攻击，攻击力为他们的和。||pictures/siege.png